{"schema_version":"1.0","id":"hl_20260226_0a2ae019","created_at":"2026-02-26T10:55:48.629554+00:00","trades":[{"entry_time":"2025-08-01 22:00:00","entry_price":3459.95397,"exit_time":"2025-08-02 02:00:00","exit_price":3523.6563004,"side":"short","qty":1.0,"pnl":-66.84495502,"reason":"sl","bars_held":5},{"entry_time":"2025-08-03 10:00:00","entry_price":3483.3483,"exit_time":"2025-08-04 00:00:00","exit_price":3539.36998891,"side":"long","qty":1.0,"pnl":52.86146568,"reason":"tp","bars_held":15},{"entry_time":"2025-08-05 14:00:00","entry_price":3575.84238,"exit_time":"2025-08-06 05:00:00","exit_price":3632.93707456,"side":"short","qty":1.0,"pnl":-60.33864531,"reason":"sl","bars_held":16},{"entry_time":"2025-08-06 07:00:00","entry_price":3638.86385,"exit_time":"2025-08-06 12:00:00","exit_price":3582.04176,"side":"long","qty":1.0,"pnl":-60.07149752,"reason":"reversal","bars_held":6},{"entry_time":"2025-08-06 12:00:00","entry_price":3582.04176,"exit_time":"2025-08-06 14:00:00","exit_price":3635.86355,"side":"short","qty":1.0,"pnl":-57.06984739,"reason":"reversal","bars_held":3},{"entry_time":"2025-08-06 14:00:00","entry_price":3635.86355,"exit_time":"2025-08-07 01:00:00","exit_price":3698.04822813,"side":"long","qty":1.0,"pnl":58.88441783,"reason":"tp","bars_held":12},{"entry_time":"2025-08-10 11:00:00","entry_price":4181.88177,"exit_time":"2025-08-10 16:00:00","exit_price":4236.4236,"side":"short","qty":1.0,"pnl":-58.33006742,"reason":"reversal","bars_held":6},{"entry_time":"2025-08-10 16:00:00","entry_price":4236.4236,"exit_time":"2025-08-11 01:00:00","exit_price":4316.6794512,"side":"long","qty":1.0,"pnl":76.40695483,"reason":"tp","bars_held":10},{"entry_time":"2025-08-11 11:00:00","entry_price":4186.98126,"exit_time":"2025-08-11 13:00:00","exit_price":4256.27199041,"side":"short","qty":1.0,"pnl":-73.09019438,"reason":"sl","bars_held":3},{"entry_time":"2025-08-11 15:00:00","entry_price":4332.63322,"exit_time":"2025-08-11 19:00:00","exit_price":4256.95135325,"side":"long","qty":1.0,"pnl":-79.54717981,"reason":"sl","bars_held":5},{"entry_time":"2025-08-11 21:00:00","entry_price":4219.87797,"exit_time":"2025-08-12 01:00:00","exit_price":4291.56473659,"side":"short","qty":1.0,"pnl":-75.51691581,"reason":"sl","bars_held":5},{"entry_time":"2025-08-12 02:00:00","entry_price":4293.02926,"exit_time":"2025-08-12 12:00:00","exit_price":4391.89882506,"side":"long","qty":1.0,"pnl":94.96134742,"reason":"tp","bars_held":11},{"entry_time":"2025-08-14 12:00:00","entry_price":4572.84267,"exit_time":"2025-08-14 13:00:00","exit_price":4397.05258365,"side":"short","qty":1.0,"pnl":171.75363348,"reason":"tp","bars_held":2},{"entry_time":"2025-08-15 07:00:00","entry_price":4643.06426,"exit_time":"2025-08-15 13:00:00","exit_price":4539.84597,"side":"long","qty":1.0,"pnl":-107.3505996,"reason":"reversal","bars_held":7},{"entry_time":"2025-08-15 13:00:00","entry_price":4539.84597,"exit_time":"2025-08-15 15:00:00","exit_price":4410.8154366,"side":"short","qty":1.0,"pnl":125.00273577,"reason":"tp","bars_held":3},{"entry_time":"2025-08-17 04:00:00","entry_price":4483.64832,"exit_time":"2025-08-17 09:00:00","exit_price":4555.21258772,"side":"long","qty":1.0,"pnl":67.49678031,"reason":"tp","bars_held":6},{"entry_time":"2025-08-18 00:00:00","entry_price":4465.05345,"exit_time":"2025-08-18 02:00:00","exit_price":4370.99786156,"side":"short","qty":1.0,"pnl":90.07936535,"reason":"tp","bars_held":3},{"entry_time":"2025-08-20 10:00:00","entry_price":4225.12247,"exit_time":"2025-08-20 11:00:00","exit_price":4156.35662454,"side":"long","qty":1.0,"pnl":-72.53751105,"reason":"sl","bars_held":2},{"entry_time":"2025-08-20 13:00:00","entry_price":4132.78668,"exit_time":"2025-08-20 14:00:00","exit_price":4212.52121,"side":"short","qty":1.0,"pnl":-83.48991855,"reason":"reversal","bars_held":2},{"entry_time":"2025-08-20 14:00:00","entry_price":4212.52121,"exit_time":"2025-08-20 17:00:00","exit_price":4332.12217234,"side":"long","qty":1.0,"pnl":115.75587282,"reason":"tp","bars_held":4},{"entry_time":"2025-08-21 13:00:00","entry_price":4261.77378,"exit_time":"2025-08-22 04:00:00","exit_price":4284.32839,"side":"short","qty":1.0,"pnl":-26.40035598,"reason":"reversal","bars_held":16},{"entry_time":"2025-08-22 04:00:00","entry_price":4284.32839,"exit_time":"2025-08-22 12:00:00","exit_price":4220.2898087,"side":"long","qty":1.0,"pnl":-67.86565949,"reason":"sl","bars_held":9},{"entry_time":"2025-08-25 00:00:00","entry_price":4700.72988,"exit_time":"2025-08-25 08:00:00","exit_price":4575.93871527,"side":"short","qty":1.0,"pnl":120.61666386,"reason":"tp","bars_held":9},{"entry_time":"2025-08-26 15:00:00","entry_price":4517.55171,"exit_time":"2025-08-27 04:00:00","exit_price":4628.14286064,"side":"long","qty":1.0,"pnl":106.47558808,"reason":"tp","bars_held":14},{"entry_time":"2025-08-27 21:00:00","entry_price":4524.04755,"exit_time":"2025-08-28 07:00:00","exit_price":4596.71265864,"side":"short","qty":1.0,"pnl":-76.76945073,"reason":"sl","bars_held":11},{"entry_time":"2025-08-28 08:00:00","entry_price":4604.26038,"exit_time":"2025-08-28 15:00:00","exit_price":4503.04965,"side":"long","qty":1.0,"pnl":-105.30901951,"reason":"reversal","bars_held":8},{"entry_time":"2025-08-28 15:00:00","entry_price":4503.04965,"exit_time":"2025-08-29 07:00:00","exit_price":4414.10279911,"side":"short","qty":1.0,"pnl":84.93413229,"reason":"tp","bars_held":17},{"entry_time":"2025-08-30 08:00:00","entry_price":4393.93935,"exit_time":"2025-08-30 13:00:00","exit_price":4332.16338587,"side":"long","qty":1.0,"pnl":-65.70271036,"reason":"sl","bars_held":6},{"entry_time":"2025-08-30 17:00:00","entry_price":4360.26393,"exit_time":"2025-08-31 00:00:00","exit_price":4467.4467,"side":"short","qty":1.0,"pnl":-111.15523978,"reason":"reversal","bars_held":8},{"entry_time":"2025-08-31 00:00:00","entry_price":4467.4467,"exit_time":"2025-08-31 23:00:00","exit_price":4419.48492205,"side":"long","qty":1.0,"pnl":-51.96089718,"reason":"sl","bars_held":24},{"entry_time":"2025-09-01 00:00:00","entry_price":4395.76038,"exit_time":"2025-09-01 07:00:00","exit_price":4456.1906411,"side":"short","qty":1.0,"pnl":-64.41363906,"reason":"sl","bars_held":8},{"entry_time":"2025-09-02 06:00:00","entry_price":4410.74103,"exit_time":"2025-09-02 11:00:00","exit_price":4351.50964423,"side":"long","qty":1.0,"pnl":-63.17439857,"reason":"sl","bars_held":6},{"entry_time":"2025-09-02 12:00:00","entry_price":4275.27243,"exit_time":"2025-09-02 13:00:00","exit_price":4347.11529361,"side":"short","qty":1.0,"pnl":-75.72293809,"reason":"sl","bars_held":2},{"entry_time":"2025-09-03 10:00:00","entry_price":4370.93705,"exit_time":"2025-09-03 14:00:00","exit_price":4455.48517171,"side":"long","qty":1.0,"pnl":80.57623171,"reason":"tp","bars_held":5},{"entry_time":"2025-09-04 06:00:00","entry_price":4364.76348,"exit_time":"2025-09-04 10:00:00","exit_price":4413.91121965,"side":"short","qty":1.0,"pnl":-53.09814326,"reason":"sl","bars_held":5},{"entry_time":"2025-09-05 07:00:00","entry_price":4415.4415,"exit_time":"2025-09-05 12:00:00","exit_price":4491.16722146,"side":"long","qty":1.0,"pnl":71.71774754,"reason":"tp","bars_held":6},{"entry_time":"2025-09-05 15:00:00","entry_price":4280.97186,"exit_time":"2025-09-07 08:00:00","exit_price":4299.82994,"side":"short","qty":1.0,"pnl":-22.71944081,"reason":"reversal","bars_held":42},{"entry_time":"2025-09-07 08:00:00","entry_price":4299.82994,"exit_time":"2025-09-07 17:00:00","exit_price":4272.07275,"side":"long","qty":1.0,"pnl":-31.61454621,"reason":"reversal","bars_held":10},{"entry_time":"2025-09-07 17:00:00","entry_price":4272.07275,"exit_time":"2025-09-07 22:00:00","exit_price":4307.63072,"side":"short","qty":1.0,"pnl":-39.41883656,"reason":"reversal","bars_held":6},{"entry_time":"2025-09-07 22:00:00","entry_price":4307.63072,"exit_time":"2025-09-08 13:00:00","exit_price":4354.06804392,"side":"long","qty":1.0,"pnl":42.53955948,"reason":"tp","bars_held":16},{"entry_time":"2025-09-09 00:00:00","entry_price":4300.06995,"exit_time":"2025-09-09 06:00:00","exit_price":4364.53641,"side":"short","qty":1.0,"pnl":-68.36553286,"reason":"reversal","bars_held":7},{"entry_time":"2025-09-09 06:00:00","entry_price":4364.53641,"exit_time":"2025-09-09 14:00:00","exit_price":4318.29042936,"side":"long","qty":1.0,"pnl":-50.15325271,"reason":"sl","bars_held":9},{"entry_time":"2025-09-09 16:00:00","entry_price":4287.87117,"exit_time":"2025-09-10 07:00:00","exit_price":4331.03306,"side":"short","qty":1.0,"pnl":-47.0403969,"reason":"reversal","bars_held":16},{"entry_time":"2025-09-10 07:00:00","entry_price":4331.03306,"exit_time":"2025-09-10 12:00:00","exit_price":4379.31189537,"side":"long","qty":1.0,"pnl":44.35918014,"reason":"tp","bars_held":6},{"entry_time":"2025-09-13 18:00:00","entry_price":4645.83537,"exit_time":"2025-09-14 02:00:00","exit_price":4686.86864,"side":"short","qty":1.0,"pnl":-45.2329868,"reason":"reversal","bars_held":9},{"entry_time":"2025-09-14 02:00:00","entry_price":4686.86864,"exit_time":"2025-09-14 04:00:00","exit_price":4661.43381,"side":"long","qty":1.0,"pnl":-29.6415661,"reason":"reversal","bars_held":3},{"entry_time":"2025-09-14 04:00:00","entry_price":4661.43381,"exit_time":"2025-09-14 05:00:00","exit_price":4679.86794,"side":"short","qty":1.0,"pnl":-22.63771579,"reason":"reversal","bars_held":2},{"entry_time":"2025-09-14 05:00:00","entry_price":4679.86794,"exit_time":"2025-09-14 07:00:00","exit_price":4651.93476,"side":"long","qty":1.0,"pnl":-32.13249121,"reason":"reversal","bars_held":3},{"entry_time":"2025-09-14 07:00:00","entry_price":4651.93476,"exit_time":"2025-09-14 14:00:00","exit_price":4591.5967116,"side":"short","qty":1.0,"pnl":56.17845924,"reason":"tp","bars_held":8},{"entry_time":"2025-09-15 05:00:00","entry_price":4664.4664,"exit_time":"2025-09-15 07:00:00","exit_price":4600.63989,"side":"long","qty":1.0,"pnl":-67.99580783,"reason":"reversal","bars_held":3},{"entry_time":"2025-09-15 07:00:00","entry_price":4600.63989,"exit_time":"2025-09-15 08:00:00","exit_price":4529.1509051,"s